1	obama's family find barack obama tree time magazine photo essay "barack tree". parents grandparents come from? biographical information mother.
2	french lick resort casino casino? find homepage casino. casinos located within day's drive lickresort jobs available resort? discounted packages staying resortand
3	getting find organized tips organized, reducing clutter managing time. take container store homepage. catalogs office supplies organization decluttering.
4	toilet i'm looking companies manufacture buy different kinds toilets exist, differ? residential toilets. parts american standard toilets? fix working properly? bidets? kohler wall-hung toilet. one?
5	mitchell find college. college homepage athletics department web pages compare colleges inconnecticut. information admissions ibecome student there?
6	find homepage kcs kansas city southern railroad. county i'm looking job kanawha schools west virginia. knox school system tennessee. information energy, inc., merger withpetrohawk energy corporation.
7	air travel find website tips. information restrictions checked baggage travel? rules liquids carry-on luggage? sites collect statistics reports airports,such flight delays, weather conditions, etc. aaa's transportation security administration(tsa) offers
8	companies i'm looking appraisals. appraisals give appraisal home's value? appraise jewelry. find examples employee performance web sites antique
9	i'm looking car parts online parts. web site. want find used sites sell car-part.com salvage junk yard. commercial vehicles heavy trucksand semis. autozone.com sources napa
10	internet cheap providers service? homepage. find low-cost broadband providers? still sell dial-up? provide inexpensive digital cable television bundled withinternet i'm looking vonage free wireless access. want dsl providers. way get access without phone take comcast's
11	gmat prep i'm looking classes companies offer classes? free sample exams practice on. i'd like find tips help well gmat. beatthegmat blog forums. take veritasprep home page. what's difference gre gmat?
12	djs disc i'm looking specialize hip-hop music. want hire dj wedding. become radio jockey? jobs available jockeys?
13	maps homepage. want take i'm looking find satellite map google msn go yahoo mapquest's free printable maps. sources live photos. online world atlas.
14	pictures dinosaurs i'm looking go discovery channel's dinosaur site, ofdinosaurs games. free dinosaurs. want find color in, acoloring book. list (or many of) different kinds ofdinosaurs, pictures. take homepage bbc series, "walking dinosaurs".
15	i'm looking information espn sports football basketball take home page. college scores. want find nba standings. baseball scores upcoming livebroadcast games. nascar races. fantasy leagues.
16	arizona game fish hunting fishing take department homepage. regulations arizona? i'm looking report site. i'd like find guides outfitters trips arizona.
17	poker tournaments find want i'm looking schedule information world series poker. las vegas. take full tilt website. atlantic city. texas hold-em tournaments. books tournament playing.
18	wedding budget want find planning looking calculator online guides, tips, checklists awedding. spreadsheets templates help tabulate abudget wedding. example budgets. i'm information shower, liketheme ideas guidelines. plan inexpensive wedding?
19	current homepage newspaper want find take current, program minnesotapublic radio. i'm looking new jersey. hartford. magazine san antonio.
20	defender homepage defender, i'm looking windows find information anti-spywareprogram. land rover sport-utility vehicle. want go marine supplies. arcade game bywilliams. possible play online? i'd like user reports particularlyproblems software. take chicago newspaper.
21	volvo find i'm looking volvo's homepage. reviews xc90 suv. semi trucks sale (new used)? dealer. online source parts.
22	rick warren's i'm looking want warren take homepage. homepage book, "the purposedriven life". background biographical information rickwarren. see articles web pages controversy overrick invocation obama inauguration. read debate john mccain barackobama hosted warren.
23	yahoo! take homepage. i'm looking yahoo mail. messenger finance. music want log account. find information yahoo!, company.
24	diversity find workplace achieved managed? free activities materials running diversitytraining program office. cultural diversity? prejudice? quotes, poems, and/or artwork illustrating promoting diversity.
25	euclid take homepage find information greek mathematician euclid. i'm looking source truck parts. industries. chemical company.
26	heart rate lower causes beat faster slower? normal person resting? rate? higher related high blood pressure orcholesterol?
27	starbucks find starbucks, take homepage. balance gift card? menu prices. calorie counts nutritional information aboutstarbucks products. recipes either making using starbucksproducts. i'm looking locations stores worldwide.
28	inuyasha find i'm looking pictures wallpaper images inuyasha. anime episodes download. games based series, either online gamesystems. fan forums websites. music television series.
29	2 playstation find games. games? ps games reviews cheat codes i'm looking sites announce new buy used specifications console?
30	diabetes education free take homepage. find materials videos, pamphlets,and books. nih national program american association educators i'm looking nutrition diet information diabetics. get posters? become educator?
31	atari find information games. want read history 2600 atarigame consoles. looking site play old games online. classic arcade
32	hosting web free find website design cheapest companies? offers webhosting? register domain name? sites offer dns hosting. reviews services, geared towards smallbusiness needs. i'm looking information courses designing sites.
33	elliptical trainer i'm looking reviews machines. buy used discounted trainer? benefits compared otherfitness machines? best trainers home use?
34	phones cell go page. page lists sale. find information companies phones? free available different vendors? at&t's verizon's prepaid phones. offerthem? kind available? nokia's home phone offer motorola sprint's buying unlocked
35	hoboken, nj. find i'm looking hoboken restaurants hoboken. homepage city history information bars nightclubs real estate listings street-level map
36	gps find reviews take units car navigation systems. garmin homepage. magazine. digital cameras built-in gps.
37	pampered chef find take homepage. host cooking show? become consultant? recipes chef. would like reviews programs,products, recipes.
38	dogs adoption find organizations offer adoption. take homepage humane society. know adopting dog?
39	disneyland find hotel hotels near disneyland. disneyland? information package deals reviews hotels. special offers reduced ticket rates take listing web site.
40	available find information take michworks michigan talent bank homepage. jobs michigan? career resources job seeking michigan. services unemployed inmichigan.
41	orange county convention center take homepage. find schedule events taking place countyconvention center. reserve event? hotels near center?
42	music man. find songs man lyrics current performances recordings i'm looking script
43	secret find reviews garden. garden book various tv movie adaptations secretgarden. i'm looking biographical notes frances hodgson burnett. information broadway musical
44	united find states maps map states. us road maps. detailed geographic political showing andtheir capitals. printable black-and-white outline thata child could color.
45	solar panels go homepage. find information kinds photovoltaic cells there? ja solarfun install home. homepage evergreen solar. nano-technological power.
46	alexian brothers find hospital go health system homepage. information lay catholic order. hospitals.
47	indexed annuity? annuity advantages anddisadvantages? kinds annuities there? buy investment companiesoffer them? find ratings annuities.
48	wilson antenna go homepage. kinds cb antennas sell? buy used antennas? best big truck? find reviews antennas.
49	flame find design i'm looking designs free clipart use website. make realistic images using photoshop? good tattoo designs. pictures flames fire. want decals put car motorcycle. stencils.
50	heat dog dogs? effect excessive symptoms stroke heat-related illnessesin find information dogs' reproductive cycle. meanwhen "in heat"?
