103	phone number adp contact claims groupon pnc esurance avast aarp claim comp cams umr prefix lookup modlily access trillium ssa dvla us sample totalsource conns service
104	bad foods high cholesterol food carbs blood acid reflux ketogenic diet causes cause saturated fats sugar cashews lentils go sources pressure make worse ldl negative effects fast
105	grief loss funeral home webster definition sympathy cycle stages mourning county assessor mo sayings models theories diagram acceptance stage bennett wormington monett messages examples downing glancy difference separation divorce quotes ambiguous disenfranchised singleton obituaries phases process counselling bargaining coping anticipatory reed steinbach
106	potato baked recipe homemade wedges bake temp crock pot chips long potato? cook soup latkes carb count making mash recipes loaded skins salad temperature toppings oven
107	net worth john mark paul matt vinny paz frusciante bezos cole bennett leblanc calaway zuckerberg kemsley jerry cantrell p diddy anthony joshua anka travolta elway attanasio pelosi david baszucki roloff bart freundlich jay sekulow
108	black meaning blackheads john blackleg color called death skin pat mahomes see spots poop lives matter rock hanson blackface wrong hannibal barca us flag tongue hole creature pienaar cardi b sirius get
109	turkey need visa travel uk kill assassinated ottomans deport armenians gavrilo princip franz ferdinand archduke acadians deported people fleeing syria president garfield penalty withdrawing roth ira columbus natives ottoman empire join ww1 armenian bd house rent john exiled patmos templars killed visit syrian refugees obama separate immigrant families
110	washington city university george central admissions state selah located medina born lynnwood application port ludlow ubi anna faris united states district court bothell lee kelso town wi chelan map camas doh county sherrifs office mai khalifa
111	heat dog dogs life expectancy symptoms long year cycle female go stroke years cycle? signs breeds lifespan characteristics season age male chart predictions time breed human converter
112	chest pain inflammation heart disease congestion left middle causes area means musculoskeletal breaking cause upper side near sternum chronic treatment wall pains types hernia hole condition infections elderly sided pleuritic around anemia
113	morning show tv news woke cbs lyrics ratings joe series theme song morning? watch morning's today today's hosts arsenal edition channel 9 workout shows contact bob dylan meet call angel world waking cast america radio best time wake
114	tools printable used print template cover letter shapes drawing make relief lasik correct presbyopia care plan creating collagen good find font arthritic fingers straightened things draw disability work created microscope sample templates stitches osha recordable get stretch marks shredded paper composted cut images ointment piles treatment makes ridgid word types
115	makes drive batteries engines drives go scooter acceleration booster tiffin motorhomes ryobi generator one eye application launcher leos use transmission power steering battery alternator choose removable mobility near advance auto codeine generac make range rover motor controls vector duromax generators force ronnie spector
116	llc city inc ca ltd management bara properties portfolio recov pra town davie building arvin haworth india pvt bh services perigold owned wayfair title security agency j r simplot company e group abm industry groups plan investments opelika al lathrop empire state development corporation enterprise holdings claims apex center arvada
117	moth moths meaning types hawk hummingbird facts balls difference caterpillar mothball fly ash codling life cycle sound magpie biblical toxic butterfly bite people kids pictures uk death tattoo privet legend mothman breathing dangerous butterflies looks like termite insect locust insects
118	taxable ira roth distributions deductible margin death premature contributions confidence interval error dividends inherited estimated useful lives depreciable assets earnings relocation allowance royalties passive income depreciation asset benefit spousal support interest taxability benefits deduct contribution accounts payable nonrecourse liabilities
119	pioneer woman mother ree girl ranch live? mary's mama may birthplace sandra day o'connor drummond jane goodall famous lee ann rimes live drummond's alive chara history women's movement store website teresa tours location meghan markle met mercantile address
120	private public ip virtual network cloud company examples range limited sector nist definitions community clouds list security agencies vpn right way laws (vpn) law addresses saba log goods reviews sectors vs compare service provider definition address
121	4 4th season grade last kingdom doe estate mean cause effect base number system pick numbers pa ages empire stage copd expect context clues piaget stages development poldark find determinant 4x4 matrix answers everfi module one president main idea worksheets list antonyms exceptions amendment atf form status travelers
122	gold nc goldsboro silver news argus mines foil experiment long john located crown hallmark stores locations klondike rush facts canyon az zip code ks bank north carolina gem map fort knox vault geiger marsden les pawn shop state employees credit union charts historical fossil tone hardware handbags describe rutherford's dollar
123	financial cash capital asset ratio net flow formula definition leverage pricing model money market insured important ratios key performance indicators examples equation gains considered income accounts structure management cost planner planning types mean position current liabilities funds fdic
124	acre per cost feet conversion land average square clearing price hemp converter root canal crown farming costs dimensions profit parking spaces foot acreage mulch yard state meter crop yield
125	cancer cause curable get mean type jim kelly anemia alicia keys stevia caillou disability h pylori radiation metastatic dysplasia stomach hereditary botox omeprazole sclerotic lesion hemorrhoids endometrial leukemia pancreatic lupus
126	yale university new address school connecticut state hospital mascot materials handling corporation health system intranet location college vs acceptance rate history meryl streep management edu time law requirements eastern central jobs attitude change approach directory business campus
127	death valley weather notify someone dies cold affect arthritis called dow falling make sick history quorn bad temperature pipes freeze jade scott happened dying dieing whether difference location oh sting national park elevation
128	walmart pharmacy hours apply phone card careers time open? schedule eye exam online money center activate capital one holiday jobs sign mastercard account take vsp walmart.com print number job applications retail store plans place order cash checks contact credit walmarts open today
129	never give gonna lyrics let thou shall song going said tragedy go waste hands shoot hoax kill verse person deprived life liberty misunderstood shalt commit adultery link wanna lose love tonight gunna ship murder family means nobody gets left behind ever rick astley
130	ants ant kill killer carpenter home yard bites pictures borax kills remedy cornmeal killing cinnamon vinegar outside treatment symptoms itch killers work infestation grasshopper story praying mantis eat ghost products recipe house damage bite remedies raid liquid
131	octagon absolute definition angles formula difference comparative monoliths el morro national monument interior burton cummings eyes types rock ks2 names solid shapes space concatenate stratified squamous epithelium structure surface area pyramid properties granite heterogeneous mixture mean deviation major minor arcana mono oryx crake summary isolated alk phos elevation sides infinity
132	ibn elbaite nipsey hussell apr ta-nehisi coates ip la llorona hoda kotb nacirema idris elba madara uchiha wilmot proviso wadu hek osha jaqi clements sina malika haqq meme folate battuta
133	important leadership oligarchy bad management vs def impeached imperialism autocratic leader government challenge process neville chamberlain resign voting matter grammarly scam political parties crush entresto irrevocable trust amended performance federation control groups servant followership task host impedisce chiusura monopolies quotes enemy
134	treatment hematoma hemorrhoids subdural epidural signs hemorrhage causes define hemolytic reactions hemorrhoid management pulmonary embolism internal retinal treatments results blood pressure systolic meaning hemolysis phlebotomy subarachnoid guidelines rectal suppository vascular access hemodialysis list hemostatic agents medicine symptoms banding procedure hemoglobin transfuse diagnosis code hematochezia edema
135	green beans pepper sodium keto recipes tea bell contain good much eat bananas potassium fluorite crystal meaning nutrition caffeine black acid reflux garlic powder sauce recipe net carbs kidney stones nutritional information canned coffee sulphur juice
136	definition sharing network examples shared agreement share centre meaning meaningful use measures list choice privilege log group communication mutual release form incorporated reference collaboration point sign networks ratio synecdoche trope solutions copay assistance dissemination information sample mou contained classification services operating model co op branching
137	missouri city population state number bureau branson counties map county routing perryville ems republic return status casenet list names o'fallon zip codes kansas regions bank articles organization show vital records community america taney collector
138	transmitted sexually sexual diseases blood side effects list metformin uk narcissism behavior patterns fetishes menstrual smell thailand bacterial symptoms define infection lyme disease hepatitis flomax women infections types immorality examples assault creatine clots menstruation
139	bankruptcy court federal search file loans inheritance monies taken trustee rules creditors case filings state help fees include student inherit debt taxes dismissed records get home loan dismissal vs discharge closing costs part mortgage us sdny u people requirements land registry lenders work
140	buddy test nmc treats tmj problems huell howser's partner makes fitbit products omeprazole used luddites jokes call remitter tsa bring acer made pronoun probate mean pep mcpon ilook like that? simvastatin dav pilkey
141	ms definition project word access schema baseline form msdcf example gantt chart security analyzer filter set allegory examples power point draft watermark css humana support portal assessment evaluation parts cross reference used critical path iif statement design information management system wbs
142	soul important difference & spirit keto work definition metaphase dalits metaphors used body composition left voice use dba stone magi lyrica controlled reflection people mind mental capacity act apply pride sin hysteroscopy exist
143	john hopkins ebp model town aultman orrville cirque du soleil kooza clarence anglin boyd ooda loop edd ultipro chs net campbell de morgan spot erocam aor omes hopkinton ri wheal a/an today aed inr gault summary el dorado springs mo obituaries fort hunter liggett mwr delavan wi u mn crookston
144	blood heart flow circulation pathway supply diagram makes pump order losartan increase pressure human vessels carry causes fluid around returns via
145	generic name cialis celebrex zanaflex available gabapentin eliquis paxil remeron vicodin percocet equivalent ventolin inhaler flovent xifaxan cephalexin lomotil controlled substance risperidone drug nexium
146	atp electron energy glycolysis demand cellular increased glycolysis, role enzyme cells function many produce full form suppose cellâs suddenly exceeds supply respiration.which statement correctly describes would lead rate production? world tennis stages respiration, transfer electrons donors acceptors plays critical overall conversion foods atp. reactions involving transfers known oxidation-reduction, redox, reactions.drag
147	anorexia nervosa risk factors cause hypothyroidism causes acne percentage world adhd etiology statistics zofran constipation congenital adrenal hyperplasia rch facts difference bulimia get eczema disease hormonal henry viii syphilis symptoms people ocd nuts treatment
148	badminton sport need nintendo switch video memory card data represented binary size court apply blue badge quantum computers ace hardware make keys checker clear shot gymnastics yoga batteries basic rules games helpful gaming satisfy dennis jernigan remember trivia coconut water electrolytes clams brains avatar 2
149	disease symptoms colonoscopy placenta genital warts leiomyoma cause hereditary dysplasia needs fibromyalgia get hysterectomy really need uterine ganglion cysts form anorexia signs previa hiatal hernia bloating crohn's lesion pancreas celiac genetic polymyalgia rheumatica curable flomax erectile dysfunction turner syndrome uterus
150	x axis independent variable function calculator dependent go x-axis domain terms derivative determine whether equation defines versus words start reflection find intercept country starts symbol bar graph ray diffraction image
151	three 3 words branches letter ending sentences 1 2 chart government tier punctuation marks end sentence point estimating technique conditional type primary germ layers phases transition text citation authors apa goverment ky pick results types describe management style hep b dose schedule compares set values three-dimensional _____. measures central tendency
152	astronomy stars constellation names pictures day list facts astrology astrological signs define astronomers moon quotes photo periodic table orbitals name leo aries today dates compatibility houses meanings galaxy core prime specs study ptolemy solar system model planetary nebula american institute aeronautics astro galileo galilei discoveries
153	guitar chords lyrics songs types used center plectrums song tabs parts acoustic notes played beat capo chart guitars pickups string instruments list gear anatomy strings words
154	dogs dog female pregnancy pregnant signs gestation age puppy period heat symptoms go long shows unique names name early mammary tumors chart neutered get housebroken menstruate phantom puberty stages abby huntsman
155	hall baseball fame willie texas rangers billy ray cyrus mcgee famers related people son players major league mays official site al kaline player team dale murphy lyrics bobby mickey mantle stats career duck dynasty robertson johnny cash hendersonville home family yankee mullet played otis campbell andy griffith cowboy mlb
156	seeds chia seed benefits dispersal importance chickpea legume ways zoysia sale pros cons eating moringa rice parable sprouted factors affecting germination benefit best way sprout part plant; structure contains shelf life good coriander uses keto friendly
157	sentence conflict interest examples word definition confounding volatile meaning? corrosive another discord insidious control ambiguous arbitrary capricious types variables example variable trouble making decisions disorder perceived undue influence cases contradiction terms meaning become ambidextrous jargon characteristics emotional immaturity hazardous symbols meanings stages borderline relationship
158	created important causes li tertiary mean lomotil controlled plan personification used fmla reference invented consignee write built giver wrote metamorphosis sarbanes oxley act ppe whitleblower voice hipaa enacted losartan cause ed fractions
159	mars earth distance travel time long take get people water many moons length day atmosphere send humans sun average problems going retrograde named km seasons
160	rock built rocks definition metamorphic facts stonehenge dome uluru form kid uses ayers king shard fossils found type types ks2 cycle history tectonic plates move owns hard formed difference stone
161	android app play store download studio wunderlist fitbit work phones pop ads showbox make development tools custom roms facetime visual game maker windows emulator caller id apps google word rooting software wechat device
162	prostate enlarged cause treatment remedy signs treatments webmd nhs cure procedures erectile dysfunction ed serious enlargement shrink gland raise psa symptom side effects function symptoms home medicine
163	customer service skills requirements goals examples code due diligence know testing phase ensures meets jobs representative rule measurable project managers ensure compliance regulations resume objective optimum altice expectations role meaning get verification definition excellence fincen performance evaluation validity information list client
164	temperature current map earth us ground change united states affect solubility depth chart national ph albuquerque nm earth's core pressure directly related mesa az lanzarote average graph definition science body celcius chandigarh today specific gravity
165	batman robin cast order movie joker film begin actors quotes beyond created animated series gotham first telltale season 1 marvel dc bane dick grayson leave list comics adam west ben affleck movies played &
166	fraction fractions convert fractional divided mm number word converting mean? metric conversion denominator chart routing insert numerator flow reserve measurement percents method partial percentage calculator percent ratio sum unit symbol
167	period comma go quotation place quotations marks question mark parenthesis quote? quotes however therefore footnote asterisk put quote citation
168	jury grand supreme court branch duty judge purpose justices judicial important electoral college attorney general selects controls bureaucracy involved system rgb chief justice united states corporate governance judy really members executive charge federal report
169	killer murder zodiac serial ted bundy caught mystery detective h holmes scott baio leave diagnosis definition really killed jonbenet ramsey ever confess signs ask jeff catch real name john sweeney murderer robber barons charles manson get robert durst id tom clancy murdered writing
170	underwater turtles long breath squid mammal whale turtle water sealant works hippo hold squidward octopus record holding life live breathe egg float amphibians lungs whales drink tortoise snapping hibernate make sounds pool frogs gills ovulate without period swim getting ears pierced orca dolphin
171	psychic real soul get cabal spirits manifest conjuring ghost use zelle transcendentalists orbs appear humans mange mediums near dreams empath judaizers abilities members cathars harriet tubman visions mental capacity act apply
172	positive new words describe attitude thinking ways improve life success benefits brave world someone means? good power quotes feel better things mean change encouraging behaviour causes babinski reflex deal claim definition importance phrases quote example reinforcements list another way say
173	definition meaning word terms define yield evidence insurability eoi form trope examples describes means egress normative statement one preamble phrase pertaining idiom bearing mind allusion example said conditions following proof concept take consideration coming
174	computer software programs file files information compression mean software? usage aptitude questions classification names examples sequence science history glossary terms install whatsapp registers architecture delete windows temp technology jobs types ppt stress testing pdf copy computers transfer systems abbreviations meanings list
175	unlock phone device mobile technology unlocked app att get mean find history patent process invented real id way learning unlocked? requirements sprint phones program key fob check need made request
176	male names guy name tom man nationality ish john stott meaning boys sam asghari perez cletus kasady ray mr real masked start b fawkes styer abu bakr meanings allstate fieri king tut wadu hek stan lee?
177	bear polar population grizzly vs bears brown weight much liver weigh current lion information important structural adaptations meat edible alaska history hear size comparison fact file timeline facts extinction articles
178	dogs failure kidney symptoms heart disease treatment congestive signs stages renal dm? dog final canine problems degenerative myelopathy acute prognosis liver
179	fire twin flame stick blaze meaning what's parts roku zodiac sign matches midway vol co nathan hale cast kindle created mustard gas flames know owns hot theodor seuss geisel difference soulmate another word flamingos different colors channels list ring blue dream ray dalio
180	weight loss cause hypothyroidism gain lose metformin prilosec wellbutrin vibration machines work laxatives make kombucha good miralax causes sudden effexor calories venlafaxine kenan thompson app noom stress levothyroxine side effects hrt help
181	cleft palate define definition decongestant diagnosis types dysarthria anarthria assume presume difference causes symptoms strep ga dol separation notice delusion reference example cause sudafed pe nasal list fallacies definitions bundle branch block lis deped sign tarsal tunnel syndrome create hanging indent word mucinex somatic symptom disorder redress grievances branchial cyst
182	film kuch carry films sirhan wondershare filmora wondering hota hai citing apa californios radisson affiliated order cast frasier movie i? list nacirema that? mot dvla ramipril used think series wangari maathai osha apply meme pll
183	thor thoracentesis commands meu tyrus gutfeld spiro agnew mata hari king agrippa chromium lexapro maoi h pylori makes motorhomes ramses ii mercury retrograde ayn rand dnce treats thoracic outlet syndrome real name gaviscon antacid blac chyna mn state abbreviation orbs
184	taxes tax income pay refund file where's much pays estimated percentage taken sc claim gross include taxes? due estimate calculate paycheck deduct assisted living interest payments deductible federal
185	mean parsed precipitates form prednisone used meaning conjunction what's function examples acas said respondent remitter community ms hse called virgo element acer ueip framework creatine reports asafetida probate
186	st thomas jude jeconiah hobbes geronimo stilton dorit kemsley jerome azor ahai cabal spiro agnew moore julius ceaser elon musk saint joel osteen taron egerton jb priestley ibn battuta ephesians aly raisman john
187	jay jack cole bennett torrey devitto henry parkes otis boykin john dalton warby parker sekulow cletus kasady swae lee kit marlowe jk rowling jem finch london jonas salk leeroy jenkins ferrell osbourne gatsby barrett jackson heston blumenthal
188	labor labour cost job symptoms fixed costing delivery stages work burden generally include types market unions important signs variable gsa categories rates approaching general description order system difference process terms calculator supply definition transition stage scope form factors affecting demand phases people
189	hipaa covered ocr entity definition mean hippa apply hhs gov omeprazole radisson affiliated esta prednisone nacirema bre tiesi think oj subject erisa list questions dnce enforces regulations needs npi ag azor ahai
190	old navy commercial mother girl sale spectrum met wives tom cruise baby lady customer service number elon musk's hughesnet gen5 womens clothes charter nurse candidate program senior ad quotes daughter home advisor woman time traveler's wife book law suite morgan freeman granddaughter affair older women masterbate list mom day chicks
191	largest tall big height tallest size biggest man ever body james hetfield john studd real chart army tom brady empire unit measurement structures world advantages structure military person robert downey jr shaq muscle carry world's burton cummings stand organ human men
192	crab calories meat recipe legs lump lobster recipes king steamed cake roll stuffed flounder baked shrimp scallops seafood fondue cook bisque tail best rangoon imitation nutrition facts grilled chicken
193	boot drive hard roblox tools devices? creator pin search taskbar cv joint replacement john wayne gacy created name test utility choose removable drives booting process computer owns ryobi testing tool create bootable master record vs guid partition makes metabo efi file find external recovery auto class codes lookup david tate
194	congress articles confederation continental session powers wrote members adopted bicameral president summary quotes constitution congressperson created list made joint represents makes founded indian national presidents
195	cost planned parenthood tubal ligation child support payment birth control treatment options tn inspire sleep apnea device mar monte jobs facts prolapsed womb mo fisher price baby swing recall keratin summary std testing restylane injections indomethacin preterm labor pills pregnancy statistics cpt code pap smear
196	alzheimer's dementia disease stages causes alzheimers cause part body affect brain pictures risk factors type treatment symptoms alzheimer timeline statins genetic benadryl definition difference types thing mental disorder history
197	diesel prices fuel price uk per current today average litre national haryana cost near gas kuwait generator list petrol france state rate gallon surcharge & historical chart
198	sacramento county ca search superior court jobs public records bank river near scotts seadoos case forms city co utilities billing ccw renewal zip codes cooperative personnel services department human assistance state portal login harris appraisal district map area west assessors office
