1	protein vegan sources list vegetarians vegetarian day diet foods budget vegans powder much food whole desserts meals per calculator get enough recipes high meal plan best source chart eat dairy one keto vega snack bar
2	important distraction mean retention range motion affect imagery used cool constipated anxiety vaping dangerous condensation occur oh dear matter reflection strictly adr advantageous palpitations kike offensive wonder threat
3	mean domain nationality ilook like people involved ce sos miscellaneous whose affiant country meaning classify called hi name ins tool pronounce citizenship ip
4	word page many pages numbers count number sides words make hexagon contents excel times appears format formatting octagon two columns footer numbering print multiple documents quart cups content duplicate
5	sirhan mean kusum sic sous vide precipitates form nb asafetida nlp moabites tofu bre tiesi aioli ibn sina abu bakr el shaddai answer hse word hoda kotb
6	largest china banks world companies biggest city united states populated cities revenue us firms usa publicly traded currency popular jobs business economy common language list asset managers assets
7	rare slim low state short blood medium define rarefy infjs intps program term o+ precious song temperature a- key lighting definition quarters list e natural minor scale rarest personality type myers briggs alt levels indicate well done crown royal extra time frame synonym level format tool shady tandem complaints
8	inclusive resorts cancun packages beaches deals nizuc resort st lucia oahu cabo san lucas package hotels albufeira aulani curacao couples grand oasis united vacations beach us family
9	science definition scientific list definitions branches variable films material deposition applications international corp mixture method steps law theory describe characteristics words terms work institute information dependent solute meaning define courses producer
10	elvis married wife presley diana princess costello krall priscilla divorce presley's wife's name kim kardashian today played xena warrior tina turner jay leno's pics lawdy miss clawdy caesar's garth brooks daughter clint eastwood britney spears aretha franklin loretta lynn remarry influenced michael jackson's book
11	healthcare united address epic medical definition health provider plan software claim insurance care database group plans user guide training manual nhs precertification list resources search partners urgent locations part h & p appeals cover letter mission statement examples f compass allied portal
12	fall meaning end life titration word loss process point add drop break copd signs times insert dropdown halo reach regress mean define endpoint protection general industry phase path exile quotes sayings risk care plan together stand divided song give
13	wisdom definition biblical god meaning temple holy spirit panel mercy grace divine scriptures sign cs lewis belief log favor word lds hope scripture god's praise bible jesus wedding words humility providence
14	calf pain treatment get muscle exercises strain symptoms dvt long allow nurse prevent diabetes tractor supply puller age mammogram velveeta dairy medical term grade 2 cause cramps maternal health important blood clot physical therapy protocol stretches mass scours calves take dayquil breastfeeding animals lyme disease
15	movie movies near times hollywood film club shows cinema theater download playing production tv nyc current theatre local location admission bar regal sites studio grill corporate office printers sam's website workday mgm employee login maker editor locations filmed cinemark upon time wiki rave clubs join
16	princeton university nj mn hospitals plainsboro medical center princeton, located? hamilton county jersey shore hospital graduate programs penn station junction open house summit bank wv related people near review colleges museum art things home page city wi careers robert mueller weather forecast
17	legs varicose veins causes treatment symptoms vasculitis lymphedema fluid leg makeup treatments edema feet myopathy vascular disease purpura stent circulation cellulitis esophagus petechiae eczema signs clogged arteries
18	routing number bank name lookup look numbers find lloyds banking contact address banks account bancorp directory m&t central transit list associated ts transaction code guide
19	tesla model build price cost stock prices supercharger locations much make reviews history power wall features map ceo elon musk test drive performance makes cars number employees mission vision range review rates state
20	used gabapentin omeprazole take prednisone work amlodipine contain valsartan aripiprazole for? pradaxa affect inr ramipril zelle venmo zantac besylate aphantasia codeine percocet prescribe naltrexone lisinopril cause ed fentanyl prescribed medication reglan indications use amiodarone atorvastatin
21	definition homologous list mono homophones meaning sapiens homonyms structures example homo homologs synapsis chromosomes examples structure intrinsic extrinsic printable e words prefix sentences functional equivalence theory nida difference diglycerides homophone equality diversity inclusion pdf characteristics english
22	chemistry definition matter element mole fume hood used exothermic reaction lab equipment list types jobs states hybridization mixture u symbol titration define indicator examples compounds concentration formula compound polarity
23	apple cider vinegar diet pills vitamin juice plan nutrition facts vitamins good take mulled recipe apples c orange wa health finder minute maid vinager vingar reviews bragg fuji diets vineger fritter work effective recipes pie filling capsules
24	worst foods arthritis food inflammation eat bad pain dogs carbs heartburn belly fat rheumatoid uk five joint vegetables diabetes make worse cheese lactose intolerance cholesterol levels
25	average age savings retirement us per income cost group child chart allowance return investment interest rate person household amount kids family support wealth vacation uk wage year
26	movie shades fifty freed theaters full online movies darker near grey watch prices come cast rent 50 order showtimes cost tickets amc matinee yesterday saturday night live fandango times south shore theater
27	penicillin narcotic cause prednisone constipation attack tizanidine adderall metronidazole get eczema invented erythromycin based doxycycline amoxicillin treat uti zosyn prescribed benadryl imitrex vancomycin azithromycin promethazine hypomagnesemia hypokalemia phentermine diazepam
28	pop quiz art nipsey definition fem amboy dukes guess song hussle hypothyroidism diazepam xmen gen z nerd warner gypsies rosicrucians created bram stoker start narcissist astigmatism hustle owns chick fil-a
29	anatomy definition posterior lower extremity vs insertion tissue treatment anterior care inferior vena cava intermediate pectoralis minor origin edema sacrum soft subcutaneous pityriasis versicolor planes sections partial circulation stroke acute subacute cellulitis vitreous detachment roux en body cavity function cortical atrophy nhs venous duplex marginal cord mid follicular phase define
30	summer day things words season list period? fist sonnet shall compare thee summer's new zealand time start end banff associated song summertime article next step vail activities fan direction information whistler jackson hole
31	ice cream maker names list ingredients invented cream? penn state recipes recipe homemade make sells cakes owns ben jerry's sherbet bars brands flavors dairy queen real commercial gluten inventor invention cone types creams
32	eobr means sciatica affiant asafetida hep get troye sivan went agt aarp bmi subject erisa sous vide virgo element azor ahai aries compatible stevia ig meme vacuole arugula called
33	taxes file pay income must tax much owe earnings required salary calculator dividends calculate paycheck h&r block charge need dependents workers comp return ssi recipients
34	mean tessellation pattern see mee ag barr tricare prime cover vision visual bts ie millenials cone edge tai chi arugula determiner target take ebt ray dalio grace madara uchiha blac chyna aries compatible asafetida sos issa rae
35	zip code tn codes thomasville nh fort gray ga need address map list county ft benning weymouth location nc duxbury knox troy mi brentwood trumbull ct clarksville district number area hermitage campbell
36	important education development questions training teacher ways educator exceed role setting goals current issues student engagement human society evaluate effectiveness types control group adaptations staff testing needs rcra become need objective resume apa formatting matter performance appraisals want teach candidates area
37	fahrenheit 451 date chart centigrade quotes summary ira faber take place ray bradbury conversion sparknotes conception due calculator step opsec process contribute sep 70 1/2 roth withdraw created calendar cliff notes amniocentesis done part 2 eggs expiration long characters chapter 1
38	fiber elastic potential energy inelastic definition fiber? help constipation calculating modulus elasticity cable connector types tighten loose skin much granola metamucil soluble celery modal fabric stretchy difference examples example shingles bilateral cause bloating good muscle connective tissue miralax
39	infection staph endometriosis cause ankylosing spondylitis pododermatitis sinus turn bronchitis mrsa bloating needs colonoscopy anorexia disease meropenem cover pseudomonas colon polyps precancerous osteoporosis occur meningitis titer people get appendicitis cancer itch grey worm flomax ed appendix signs group strep vaginitis hereditary
40	foods good help pickles list anemia lupus bowel movements lecithin gastritis cucumber you? take metformin food combat gout eat osteopenia bloating trigger pheochromocytomas starch cucumbers probiotics contain lectins rhubarb hypothyroidism
41	maine town county state presque isle court corinth, cape elizabeth hermon kennebunk abbreviation houlton windham, title division city lewiston district oob list counties casco oxford registry deeds ems ceh report somerset map code wi alfred superior
42	chicken frozen breast cook raw temp pressure internal cooked cooker air fryer long keep refrigerator grilled refreeze boil feed dog freeze bake ways boneless tenders fry make ahead freezer meals recipe canned
43	italian italy word bella mean malta part mark simone st patrick italians called dagos history language apply passport words phrases vouchers ask terms endearment italy's leader reference english leonardo dicaprio americans live goodbye gestures meanings ciao meaning ariana grande renaissance begin
44	bone density tissue results structure test explained process formation protein explain diagram morphogenetic 2 recommendations guidelines combining form functions growth scan interpretation callus healing morphogenic definition connective histology cross section causes spurs types bones skeletal system
45	sidney john city oh mark levin patrick henry leeroy jenkins radon bowlby mystery babylon nirav modi omeprazole ag barr abe lincoln paye proctor pol pot mata hari elie saab dav pilkey alan greenspan
46	legal attorney aid court power judicial lawyer character office counsel doj community service list services eoir qualify confirms general fisa judges rgb judge gets watch find adviser advisor form branch reference letter case manager nysif mean guide statement
47	formula acetic acid acetate definition general alkene mechanism action ethyl density alkenes alkane alkyne use strontium cation anion dopamine function dissociation isoproterenol chemical functional group ketone aspartame acesulfame k storage requirements cas number glycol ether pm molecular chlorothiazide
48	stock market closed today close banks closing us days monday day daily prices date yesterday exchange markets drop month accounting year ein numbers veterans closings early closes time presidents
49	pay military salary army chart scale average basic rank officer grades enlisted sdap wages vet tech police drill us federal workers general national security advisor charts dfas chief staff
50	number calling called abbreviated calls ask put call dialing look whos this? reference letter dial contact options block difference option question mark quotes router need eori questions references rings
51	ankle pain burning causes sensation heel area swelling edema sharp stabbing joint avulsion fracture hurting rash foot back symptoms sprained top side plantar fasciitis ankles
52	hamitic peoples seleucids beto orourke moabites kurds draco malfoy cushites today torrey devitto minoans sargon akkad spiro agnew ainu people shatta wale sumerians abu bakr canaanites powhatan aly raisman pleiadians rohingyas
53	word definition single major space mono spacing flat double scale e document one independent monosyllabic key monosaccharide basic figures speech minor difference polyunsaturated line homogeneous heterogeneous communication generic terms conditions subordinate clauses livingstone solid surface colors levels variables
54	paris treaty agreement created shanghai us see terms nanjing middle colonies founded memorandum understanding binding signed system checks balances important allied powers golden gate bridge built go xi jinping power ratify treaties representative allies partition india happen united nations hangzhou must file schedule se shoguns
55	suicide squad assessment scale cast safety plan printable characters prevention number intent jack kevorkian risk template cams forms main hotline hot line lifeline website ideation movie method chart beck el diablo signs symptoms assisted case tools test becks machine
56	electrical engineering types engineer panels requirements expected engineer? terms abbreviations & equipment information certification electric provider clearance qualified worker training salary degree osha circuit design software job outlook list materials cable uses importance formula power sic code contractors drawings duties
57	provider eligibility access standard plus care subject request form vcenter manage essentials priority partners portal get pnr status enquiry cvs hsa eligible items notice basic cms competency assessment tool accepts vsp vision ushealth group make example ncoer support guidance itemize take deduction mandatory list integration requirements uses primary data services
58	portable generator makes engine gas appliances calor engines exide batteries compressed air tank fire stick work motor unit electricity stored owns ge another word fires heaters works sizing calculator fluid sound enclosure meme whynter odes ryobi created steam ho chi minh
59	worth win victory success targeted election spin id acuralink control kc chiefs voice? nguyen pronounced another word death groupon world definition essay awd cavs instacart roku bring invisalign came great compromise
60	meaning words definition scriptures thankfulness gratitude word biblical grace hope list inspirational support savior examples cultural humility someone helps salvation god god's name means redeemed lord scripture encouragement good days provider portal adp statement self service appreciation agape love blessing another thank
61	graduation wedding party announcements wear women dresses engagement 2019 invitation wording outfits prom dress alterations near attire attending things invite bring gift photo steps planning quotes speech design places parties gifts honor cords sample photos another word
62	herpes pimples simplex get zoster virus 1 quiz throat canker sore genital curable causes type stomach ulcer face 2 hurt mrsa staph infection test genitalis oral contagious shingles bites look like bronchitis
63	gas propane cause density liquid description types mask peoples contact number edamame calculate steam oxygen artichokes volume state matter rate calculation formula smoke ideal law questions composition air properties phet simulation origin term gaslighting
64	quizlet answers quiz database knowledge computer questions software? guess character basic risk management sharepoint elements compounds managerial accounting reports human capital general online price floor anagrams periodic table examples access tables math brain teasers discovery word search puzzlemaker use virtual machine test hypothesis stem cells derivative classification exam
65	lake mountain lady weather district va mohonk city fl ms forecast lakegirl address lodge resort isabella ca family resource center house arrowhead community association horn town beatrix potter holiday cross junction county tour de cure nona eola park events shasta hide way
66	fries french called eat recipes meat cucumbers cucumber carbs swine meal worms blobfish sweet potato keto ground venison jerky loaf leftover gammon hamsters pickle gherkin bread butter pickles mincemeat pie broccoli animal waffle near calories curly history bad
67	organ function organs functions example system systems following contains villi? sacco vanzetti vagus nerve afib juxtaglomerular apparatus anus corti definition trachea prescribe accutane strep esophagus mitral valve structure sarcomere hepatic panel tests organelles parietal cells
68	number global phone entry international tel link card contact list codes customer service dialing booking.com usps id location activate account lookup calling directory mobile subscriber identity cell plans schedule appointment known traveler
69	strawberries freeze nutrition good cranberries sale need facts cranberry hulled refrigerated? eat chokeberries growing containers balsamic vinegar refrigeration dried plants best way wash locally blueberries sauce fresh juice help uti near peaches value recipes using frozen
70	wrote remitter authored desperation mystery babylon created swot analysis oedipus rex lean jose marti geronimo stilton elan musk sleepy hollow hedy lamarr hey jude days giver book wonder cabal dorit kemsley way maggie may
71	niels bohr neutrophils definition pseudoephedrine controlled diagnosis code nephrolithiasis hapsburgs nacirema anemia hernia ekg test flomax cause ed dr gundry pusha acer ueip framework dr. sebi hysteroscopy niacin neurologist rivaroxaban affect inr hedy lamarr
72	difference definition presume assume synonym explicate declaration indiscrepancy word sine rule ambiguous case stages borderline relationship address issue different words conclusion citation referencing sudafed mucinex make meaning dealing ambiguity examples beg question fallacy enquiry inquiry lew define " ' e.g. i.e. areas concern
73	disney magic fireworks cake kingdom world food schedule time extra hours angel recipes pops much dessert bands designs freeze birthday whole foods chantilly price disneyland paris wine ingredients cruise feel love tonight princess quiz band colors tickets recipe weight watchers
74	zip code address find county codes lookup location luling look windham area finding search need medford number us
75	nfl teams today printable standings game guess football games play list decon uniforms plays pass mã©xico team sheets carries network terry crews stats wild card injury report current playoff scenarios division player divisions chart original names
76	north carolina nc license lumberton, lumberton counties state court town general statutes county robeson crv center verification map renewal business probate pinehurst corporation commission contractor forestry association forest service government houses sale laws federal city list pinetops
77	kidney stones cause kidneys women get disease foods creatine effects metformin damage excessive spinach consumption lisinopril problems bloating dehydration pain causes eat considered medications creatinine levels people ranitidine side affect milk
78	elevation warrensburg site step opsec process ad mean la paz kunta kinte william seward level pidgey evolve advanced agt audre lorde geert hofstede find address steny hoyer monarch glen cast needs npi carter g woodson tudors wilmot proviso danai gurira henry parkes
79	lord henry haw stanley dauphin mcpon ree drummond jean piaget viii father voldemort milgram current inspector general karrueche tran tudor louis xiv olly murs claes oldenburg kublai khan andrew cunanan william tell king agrippa prince
80	phone number ssa wnli area codes list dvla spectrum retention department ca edd atf nfa fpl pa dmv us imaging mcafee adp contact liberty mutual claims llok wa dol mo dor gov net flix connections academy
81	last avatar airbender season 1 3 game episodes air episode quiz gogoanime comics online games books book cast avatars stream watch bender 7 wikia film
82	license renewal driver's drivers cost driving driver form dps renew fee locations requirements ca much motor vehicle current status licence test questions look information dmv grace period nd
83	different types flowers names plants orchid plant flower bushes vanda orchids leaf colors roses look like ferns color meanings symbolism leaves yew shrubs meaning rose ficus repotting description chart methods propagation care spirea botanical gardens show kinds
84	rhetorical example definition monologue questions meme define ethos analysis respondent called say voice siri exo bias telling petitioner writing vacuole wrote consitution remitter precipitate form calling carrier straight talk rhetoric
85	killer kill killed murder zodiac really who's real name collusion crime bobby shmurda jeff rasputin oj ray lewis case happened aaron hernandez john sweeney murderer btk people involved death penalty created jonbenet ramsey robespierre executed chris kyle gianni versace murdered mystery near snape dumbledore
86	cost movies movie tax deductible tuition much ticket college hulu average rent pay application fees prices 2018 tv student loan owe showtime subscription tickets gift card payments dollar near private school lyft charge per passenger spirit airlines view
87	missouri state show search jobs real vital cities department many reps casenet courts case net area codes places visit refund id requirements bureau records list career center vehicle title statistics revenue locations return status population cna registry verification estate forms
88	women vote right usa first get american woman rights amendment suffragette movement guess girl coupon code state give given child brides got list ladies league voters gain womens giving voting votes uk
89	example speciation use mean swot analysis folate determiner sos oh dear matter sympatric makes scion picts annuitant hazard guess meaning hypothesis question scatter plot reflexology miscellaneous pleiadians claim ppi eliquis affect inr prilosec cause constipation hep curable
90	ham cooking time recipe baked crock pot cooked recipes cook crockpot butt portion hock sides gravy temp glaze already spiral reheating temperature hocks left precooked
91	control panel system settings unit document functions review example policy define display types charts decision officer process take center configuration manager function icon view interface procedure examples planning analysis group command line requirements go definition operating systems documentation guidelines language
92	soil clover good erosion plants fertilizer weeds ash gardens lawns gravel best types need grass compost micro seed coloured herbicide tomato leaves curled important control methods cause pollution broadleaf impacts clippings pea drainage zoysia pictures
93	zip code cleveland tx browns oh brownsville brownsburg points interest meet cast centerville fort campbell katy flats east bank carrollton lisle il trumbull ct bessemer al canyon inn salida co akron wi weis markets honesdale pa arlington la grange & p summary population tn
94	wrist brace thumb muscles types weight lifting support hand supports medical braces anatomy exercises straps right movements terms afo term joint flexion slac forearm golfers
95	switzerland cities president language map capital switzerland? list eea main tudor watches country weather davos direct democracy current time right visit part schengen leader type government spoken currency things geneva
96	dare id font picts inklings virginia amorites gerd nirav modi annuitant dav pilkey ammonites st jerome state abbreviation day stand rafael nadal seleucids clause examples sas visual bts word californios
97	right pain side back upper lower cause constipation severe body abd hurt sharp waist arm
98	unemployment benefits insurance compensation number collect pa social security state claim administers federal laws? eligible find account office website pay taxes taxed rates lookup rate checking status application form pays & applying department labor tax id
99	nutritional value seeds benefits flax cauliflower protein watermelon benefit health tamarind cashew nuts chia pomegranates bean sprouts pomegranate nutrition facts flaxseed safe eat eating avocado vegetable juice good corn wild rice vegetables chart cucumbers
100	us passport cost visa renewal fees payment requirements application place issue department state expedited usa postal stamps process apply citizenship united states become citizen fee restrictions
101	weight archery gain near draw leg exercises weights golf range mean national guard requirements age get shingles shot limit parasailing taylor swift english longbow sport yarn brands xarelto cause viggo mortensen list shift height use midsize grips ankle work supplies clubs plays arrow lifting runners
102	camera motion sensor types security angles shots device close shot photographic memory real roku dvr capabilities systems transfer pictures computer aperture controlled film picture frames different shutter speed type activated focal length photography contact lenses go behind eye examples lights outdoor
